{
  "$id": "klage-hjemsendt",
  "$schema": "http://json-schema.org/draft-07/schema#",
  "description": "Dokumentdata for brev klage hjemsendt",
  "type": "object",
  "required": [
    "felles",
    "gjelderTilbakekreving",
    "opphevet",
    "ettersendelsesfrist"
  ],
  "properties": {
    "felles": {
      "$ref": "file:content/templates/schema_felles.json"
    },
    "gjelderTilbakekreving": {
      "type": "boolean"
    },
    "opphevet": {
      "type": "boolean"
    },
    "ettersendelsesfrist": {
      "type": "string"
    }
  }
}
