{
  "felles": {
    "søkerNavn": "Dolly Duck",
    "søkerPersonnummer": "300220 12345",
    "fritekst": "FRITEKST",
    "brevDato": "4. mai 2021",
    "erAutomatiskBehandlet": false,
    "saksnummer": "123456789",
    "ytelseType": "FP",
    "behandlesAvKA": true,
    "erUtkast": false
  },
  "gjelderTilbakekreving": true,
  "opphevet": true,
  "ettersendelsesfrist": "14. juni 2021"
}